{
  "after": "NOISE",
  "before": "QUIET",
  "changed_sha256": "453d8d58167148b5f62d91aff60279ce4b1c774ce3dba4628179df64f6517b8f",
  "manifest_version": 1,
  "operation": "replace_alpha_literal",
  "original_sha256": "564ac8e7b28234891db68640a18f635e98914336fe886e9b922f7517b474bfd3",
  "prose": "Replace one EOF fallback literal before truncating MOVE; actual EOF/witness behavior is pending.",
  "target": {
    "byte_end": 865,
    "byte_start": 858,
    "file": "original.cbl",
    "line": 34,
    "node_kind": "literal"
  },
  "task_id": "status-fallback-02-change"
}
