{
  "after": "BLANK",
  "before": "EMPTY",
  "changed_sha256": "54d885a6283fa9fb86dd0931e86ee83449c796e57e0ea41d7f7fc89a5b633d29",
  "manifest_version": 1,
  "operation": "replace_alpha_literal",
  "original_sha256": "9774bc0d23880d99cf28bafbf3c61cf1a5519186f082ce201efc7290af9b771f",
  "prose": "Replace one EOF fallback literal before truncating MOVE; actual EOF/witness behavior is pending.",
  "target": {
    "byte_end": 663,
    "byte_start": 656,
    "file": "original.cbl",
    "line": 25,
    "node_kind": "literal"
  },
  "task_id": "status-fallback-01-change"
}
